{
    "id": "test_arena_v1",
    "biome": "cave",
    "notes": "",
    "pieces": [
        {
            "id": "room_01",
            "size": {
                "w": 32,
                "h": 32
            },
            "exits": {
                "N": false,
                "S": false,
                "E": false,
                "W": false
            },
            "friction": [
                "################################",
                "#.........................######",
                "#.........................######",
                "#.........................######",
                "#.........................######",
                "#.........................######",
                "#.........................######",
                "#.........................######",
                "#.........................######",
                "#.........................######",
                "#.........................######",
                "#.........................######",
                "#.........................######",
                "#.........................######",
                "#.........................######",
                "#.........................######",
                "#.........................######",
                "#.........................######",
                "#.........................######",
                "#.........................######",
                "#.........................######",
                "#.........................######",
                "################################",
                "################################",
                "################################",
                "################################",
                "################################",
                "################################",
                "################################",
                "################################",
                "################################",
                "################################"
            ],
            "sockets": {
                "spawns": [
                    {
                        "x": 2,
                        "y": 2
                    }
                ],
                "markers": [
                    {
                        "x": 3,
                        "y": 2,
                        "id": "A"
                    }
                ],
                "waypoints": [
                    {
                        "x": 2,
                        "y": 3
                    }
                ]
            },
            "tags": [
                "room",
                "t"
            ],
            "biome": "cave"
        }
    ]
}
